{"diagnostics":[],"evidence":[],"operation_id":null,"request_id":"cli","result":{"authenticity":"not_established","current_image_verification":"not_performed","definition":{"export":{"case":{"operation_id":"image-op:e2df205043b2c69ce5cc78225a596b0a","revision":"sha256:ca216a61929fe8b2deb29f31527955e38ba2c692b181020628a39cacde8d5cc8"},"effect":{"artifact":{"bytes":"790","digest":"sha256:3b0da3dc51b78a8170ff98f71d82ffbeaf010eeda06d6bef17fcbc002361d5d2","encoding":"private-case-json-utf8-lf/1","policy":{"customer_data":false,"identifiers":false,"interpretations":false,"raw_values":false},"scope":"recorded-acquisition-case-support"},"resources":{"destination":{"access":"create-write","epoch":"sha256:ef736eaeb0c0e6de621ba164ad964857ae4c821fe2223f4e6aabf9d0001aa275","identity":"location:sha256:780725608e63ea1c2266c9c35c5bc629e350494d419236c2bb2d3454d361e342","location":"D:\\Projects\\DiskEd\\disked\\.aide-local\\report-cli-tail-warm-46b7dba5\\never-created.json","verification":"readback-sha256"},"producer":{"access":"read","digest":"sha256:bd9e154836b48e7e9d46ed59ee02a23dfb689d0576d3ab87a6879be3bcc460c8","epoch":"sha256:217db76b38d7e4d6ac7be59a0796d8f8e00dc45ab00e5bccd33f2c2b9c28497a","identity":"file:sha256:64a766df26e7f8475b4be6096ba5b386b0db888468fcc52f0358a9819100aad2","location":"D:\\Projects\\DiskEd\\disked\\.aide-local\\exfat-tree-file-exact-11e6f625\\build\\Release\\disked.exe"}},"schema":"org.disked.report-export-definition-prototype/1"},"schema":"org.disked.acquisition-case-export-definition-prototype/1","source":{"access":"read","ancestors":[{"created":"134159862750000000","file_id":"05000000000005000000000000000000","volume_id":"3781016413010784355"},{"created":"134164978333079622","file_id":"3e000000000003000000000000000000","volume_id":"3781016413010784355"},{"created":"134355181829138994","file_id":"17dc1d00000009000000000000000000","volume_id":"3781016413010784355"},{"created":"134355182027398762","file_id":"9c421e0000000a010000000000000000","volume_id":"3781016413010784355"},{"created":"134355196368608886","file_id":"f90b2d00000009000000000000000000","volume_id":"3781016413010784355"},{"created":"134364927553932724","file_id":"f2d5280000000a000000000000000000","volume_id":"3781016413010784355"},{"created":"134364927555033927","file_id":"61062900000006000000000000000000","volume_id":"3781016413010784355"},{"created":"134364932713507092","file_id":"8d23290000000a000000000000000000","volume_id":"3781016413010784355"},{"created":"134364934020224501","file_id":"a323290000000b000000000000000000","volume_id":"3781016413010784355"},{"created":"134364934020224501","file_id":"a4232900000009000000000000000000","volume_id":"3781016413010784355"}],"authenticity":"not_established","case_revision":"sha256:ca216a61929fe8b2deb29f31527955e38ba2c692b181020628a39cacde8d5cc8","files":[{"digest":"sha256:21d9c098358d6e0d273d7e5df733cdbad554e7fdfddbb5d80a94561c9da903cb","metadata":{"attributes":"32","bytes":"4681","changed":"134364934028989527","created":"134364934028984516","file_id":"b2232900000009000000000000000000","hardlinks":"1","volume_id":"3781016413010784355","written":"134364934028989527"},"name":"acquisition.request"},{"digest":"sha256:a047b600ad3029af3bb520c8016112c5e12da7c4705d84ecb92eec2291ee970f","metadata":{"attributes":"32","bytes":"7489","changed":"134364934056105258","created":"134364934021379526","file_id":"af232900000009000000000000000000","hardlinks":"1","volume_id":"3781016413010784355","written":"134364934056105258"},"name":"acquisition.records"}],"provenance":"ordinary-file-read-and-record-validation","schema":"org.disked.file-acquisition-case-source-prototype/1","store":{"access":"create-owned-metadata","children":["acquisition.request","acquisition.records","acquisition.cancel","acquisition.admission"],"failure_domain":"observed-file-volume:3781016413010784355","generation":{"created":"134364934020224501","file_id":"a4232900000009000000000000000000","volume_id":"3781016413010784355"},"path":"D:\\Projects\\DiskEd\\disked\\.aide-local\\exfat-tree-file-exact-11e6f625\\source\\.aide-local\\disked-acq-worker-_zqxk64f\\case"}}},"host_id":"ebb1f96469b3e4cc186d3af02b5e8a7127359574ccd4a69a6b80c505e7b2b0b7","image_digest":"bd9e154836b48e7e9d46ed59ee02a23dfb689d0576d3ab87a6879be3bcc460c8","input_digest":"sha256:22b555cca3f2ca482018e4bbeed5999e46921c535ff1414ea112a63da8c7d8ce","schema":"org.disked.report-worker-definition-prototype/1","source_revision":"11e6f6258a966b716a58a3336ff07aea8bf60e70","store":{"access":"create-owned-metadata","ancestors":[{"created":"134159862750000000","file_id":"05000000000005000000000000000000","volume_id":"3781016413010784355"},{"created":"134164978333079622","file_id":"3e000000000003000000000000000000","volume_id":"3781016413010784355"},{"created":"134355181829138994","file_id":"17dc1d00000009000000000000000000","volume_id":"3781016413010784355"},{"created":"134355182027398762","file_id":"9c421e0000000a010000000000000000","volume_id":"3781016413010784355"},{"created":"134355196368608886","file_id":"f90b2d00000009000000000000000000","volume_id":"3781016413010784355"},{"created":"134365561410912989","file_id":"b7ab2a00000004000000000000000000","volume_id":"3781016413010784355"},{"created":"134365561410968002","file_id":"b9ab2a00000006000000000000000000","volume_id":"3781016413010784355"}],"children":["report.request","report.records","report.cancel","report.admission"],"failure_domain":"observed-file-volume:3781016413010784355","generation":{"created":"134365561410968002","file_id":"b9ab2a00000006000000000000000000","volume_id":"3781016413010784355"},"path":"D:\\Projects\\DiskEd\\disked\\.aide-local\\report-cli-tail-warm-46b7dba5\\state"},"target_profile":"windows.nt10.x64.win32"},"definition_digest":"sha256:8a0cd85dbbabf153dd4774c9ec6b769fce093a2a8f42bff40c18787eb391fc41","execution_admitted":false,"phase":"prepare","scope":"recorded-acquisition-case-support-export"},"schema":"org.disked.response/1","status":"completed"}
